{
  "schema_version": "udh.worker-result/2",
  "worker_id": "worker-demo",
  "assignment_id": "assignment-demo",
  "role": "planner",
  "session_id": "session-demo",
  "base_control_revision": 1,
  "input_bundle_digest": "sha256:aaaaaaaaaaaaaaaaaaaaaaaaaaaaaaaaaaaaaaaaaaaaaaaaaaaaaaaaaaaaaaaa",
  "snapshot_digest": "sha256:bbbbbbbbbbbbbbbbbbbbbbbbbbbbbbbbbbbbbbbbbbbbbbbbbbbbbbbbbbbbbbbb",
  "status": "completed",
  "summary": "구체 계획 초안을 제안한다. 승인 또는 실행 허가가 아니다.",
  "evidence_ids": [
    "evidence-1"
  ],
  "proposals": [
    {
      "proposal_id": "proposal-1",
      "kind": "plan",
      "artifact": {
        "artifact_id": "artifact-demo",
        "digest": "sha256:aaaaaaaaaaaaaaaaaaaaaaaaaaaaaaaaaaaaaaaaaaaaaaaaaaaaaaaaaaaaaaaa",
        "media_type": "text/plain"
      },
      "rationale": "빈 입력과 정상 입력을 함께 검증한다."
    }
  ],
  "findings": [],
  "unknowns": [],
  "limitations": [
    "합성 예시"
  ],
  "created_at": "2026-09-15T07:00:00Z"
}
